{
  "$schema": "../../docs/GATE3C_SCENARIO_SCHEMA.json",
  "schema_version": "1.0",
  "scenario_id": "HAR_0001_h3h5h7_typical",
  "class": "Harmonics",
  "label_idx": 1,
  "label_source": "SCENARIO_CONTROLLER",
  "electrical_model": {
    "reference_model": "IEEE_9bus/IEEE_9bus_PQD_HIL_R2025a.slx",
    "working_model": "IEEE_9bus/IEEE_9bus_PQD_DISTURBANCES.slx",
    "model_unchanged": true
  },
  "injection_location": {
    "bus": "Bus5",
    "measurement_point": "Vabc_5",
    "mechanism": "HARMONIC_CURRENT_SOURCE",
    "phase": "ABC"
  },
  "nominal_frequency_hz": 60.0,
  "sampling_rate_hz": 5000.0,
  "window_samples": 1000,
  "window_ms": 200.0,
  "seed": 20261004,
  "operating_condition_id": 1,
  "parameters": {
    "harmonic_orders": [3, 5, 7],
    "harmonic_currents_amps": {
      "h3": 45.0,
      "h5": 28.0,
      "h7": 16.0
    },
    "harmonic_magnitudes_pu": {
      "h3": 0.058,
      "h5": 0.026,
      "h7": 0.027
    },
    "thd_target_percent": 8.24,
    "sensor_noise_snr_db": 52.0
  },
  "parameter_provenance": {
    "harmonic_orders": "ENGINEERING-INTERPRETATION",
    "harmonic_currents_amps": "ENGINEERING-INTERPRETATION",
    "harmonic_magnitudes_pu": "ENGINEERING-INTERPRETATION",
    "thd_target_percent": "DATASET-DESIGN-CHOICE",
    "sensor_noise_snr_db": "SIMULATION-PARAMETER"
  },
  "standard_references": [
    {
      "standard": "IEEE Std 519-2022",
      "clause": "Clause 3.1.25, Table 1",
      "applies_to": "Harmonic frequency definition (n*f1); voltage THD limits at PCC"
    },
    {
      "standard": "IEEE Std 1159-2019",
      "clause": "Clause 4.4.4.1",
      "applies_to": "Harmonic phenomenon definition; steady-state continuous duration"
    }
  ],
  "validation_gates": {
    "method": "HARMONIC_ANALYSIS",
    "pass_conditions": [
      {
        "metric": "thd_percent",
        "operator": ">",
        "threshold": 5.0,
        "unit": "%"
      },
      {
        "metric": "h3_pu",
        "operator": ">",
        "threshold": 0.03,
        "unit": "pu"
      },
      {
        "metric": "h5_pu",
        "operator": ">",
        "threshold": 0.01,
        "unit": "pu"
      }
    ]
  },
  "normal_contamination_check": {
    "metric": "thd_percent",
    "must_differ_from_normal_by": "> 5% (Normal THD < 0.09% at Bus 5)"
  },
  "dataset_partition": {
    "group_id": "har_cond01_seed20261004",
    "split": "train"
  }
}
