{
  "schema_version": "1.0",
  "scenario_id": "SWELL_0001_three_phase_symmetric",
  "class": "Swell",
  "label_idx": 6,
  "label_source": "SCENARIO_CONTROLLER",
  "electrical_model": {
    "reference_model": "IEEE_9bus/IEEE_9bus_PQD_HIL_R2025a.slx",
    "working_model": "IEEE_9bus/IEEE_9bus_PQD_DISTURBANCES.slx",
    "model_unchanged": true
  },
  "injection_location": {
    "bus": "Bus4",
    "measurement_point": "Vabc_5",
    "mechanism": "CAPACITOR_SWITCH",
    "phase": "ABC"
  },
  "nominal_frequency_hz": 60.0,
  "sampling_rate_hz": 5000.0,
  "window_samples": 1000,
  "window_ms": 200.0,
  "seed": 42,
  "operating_condition_id": 1,
  "parameters": {
    "magnitude_pu": 1.33,
    "capacitive_power_mvar": 150.0,
    "damping_power_kw": 100.0,
    "duration_cycles": 4.8,
    "duration_ms": 80.0,
    "onset_time_ms": 40.0,
    "transition_type": "POINT_ON_WAVE",
    "sensor_noise_snr_db": 52.0
  },
  "parameter_provenance": {
    "magnitude_pu": "STANDARD-SUPPORTED",
    "duration_cycles": "STANDARD-SUPPORTED",
    "duration_ms": "PROJECT-DESIGN-CHOICE",
    "onset_time_ms": "PROJECT-DESIGN-CHOICE",
    "transition_type": "ENGINEERING-INTERPRETATION",
    "capacitive_power_mvar": "SIMULATION-PARAMETER",
    "damping_power_kw": "SIMULATION-PARAMETER",
    "sensor_noise_snr_db": "SIMULATION-PARAMETER"
  },
  "standard_references": [
    {
      "standard": "IEEE Std 1159-2019",
      "clause": "Table 2 / Clause 3.1.65",
      "applies_to": "Swell magnitude [1.10, 1.80] pu, duration 0.5 cycle to 1 min"
    },
    {
      "standard": "IEC 61000-4-30:2015",
      "clause": "Clause 5.2",
      "applies_to": "Half-cycle RMS U_rms(1/2) measurement aggregation"
    }
  ],
  "validation_gates": {
    "method": "WINDOWED_RMS",
    "pass_conditions": [
      {"metric": "windowed_rms_max_pu", "operator": ">", "threshold": 1.10, "unit": "pu"},
      {"metric": "windowed_rms_max_pu", "operator": "<=", "threshold": 1.80, "unit": "pu"},
      {"metric": "swell_duration_ms", "operator": ">=", "threshold": 8.33, "unit": "ms"},
      {"metric": "system_freq_hz", "operator": ">=", "threshold": 59.5, "unit": "Hz"},
      {"metric": "thd_percent", "operator": "<", "threshold": 5.0, "unit": "%"}
    ]
  },
  "normal_contamination_check": {
    "metric": "windowed_rms_max_pu",
    "must_differ_from_normal_by": "> 1.10 pu (elevated above Normal steady-state upper bound)"
  },
  "dataset_partition": {
    "group_id": "swell_cond01_seed42",
    "split": "test"
  }
}
