{
  "$schema": "../../docs/GATE3C_SCENARIO_SCHEMA.json",
  "schema_version": "1.0",
  "scenario_id": "TRAN_0001_three_phase_typical",
  "class": "Transient",
  "label_idx": 7,
  "label_source": "SCENARIO_CONTROLLER",
  "electrical_model": {
    "reference_model": "IEEE_9bus/IEEE_9bus_PQD_HIL_R2025a.slx",
    "working_model": "IEEE_9bus/IEEE_9bus_PQD_DISTURBANCES.slx",
    "model_unchanged": true
  },
  "injection_location": {
    "bus": "Bus5",
    "measurement_point": "Vabc_5",
    "mechanism": "CAPACITOR_SWITCH",
    "phase": "ABC"
  },
  "nominal_frequency_hz": 60.0,
  "sampling_rate_hz": 5000.0,
  "window_samples": 1000,
  "window_ms": 200.0,
  "seed": 20261007,
  "operating_condition_id": 1,
  "parameters": {
    "inductance_henries": 0.002,
    "capacitance_farads": 0.000008,
    "damping_resistance_ohms": 0.8,
    "onset_ms": 104.2,
    "transient_duration_ms": 30.0,
    "sensor_noise_snr_db": 52.0
  },
  "parameter_provenance": {
    "inductance_henries": "SIMULATION-PARAMETER",
    "capacitance_farads": "SIMULATION-PARAMETER",
    "damping_resistance_ohms": "SIMULATION-PARAMETER",
    "onset_ms": "PROJECT-DESIGN-CHOICE",
    "transient_duration_ms": "ENGINEERING-INTERPRETATION",
    "sensor_noise_snr_db": "SIMULATION-PARAMETER"
  },
  "standard_references": [
    {
      "standard": "IEEE Std 1159-2019",
      "clause": "Clause 4.4.1.2, Table 2",
      "applies_to": "Low-frequency oscillatory transient (< 5 kHz, duration 0.3-50 ms)"
    }
  ],
  "validation_gates": {
    "method": "TRANSIENT_ENERGY",
    "pass_conditions": [
      {
        "metric": "peak_excursion_pu",
        "operator": ">=",
        "threshold": 0.15,
        "unit": "pu"
      },
      {
        "metric": "dominant_freq_hz",
        "operator": ">=",
        "threshold": 250.0,
        "unit": "Hz"
      },
      {
        "metric": "dominant_freq_hz",
        "operator": "<=",
        "threshold": 1500.0,
        "unit": "Hz"
      },
      {
        "metric": "transient_duration_ms",
        "operator": "<=",
        "threshold": 50.0,
        "unit": "ms"
      },
      {
        "metric": "system_freq",
        "operator": ">=",
        "threshold": 59.5,
        "unit": "Hz"
      },
      {
        "metric": "system_freq",
        "operator": "<=",
        "threshold": 60.5,
        "unit": "Hz"
      },
      {
        "metric": "rms_pre_pu",
        "operator": ">=",
        "threshold": 0.50,
        "unit": "pu"
      },
      {
        "metric": "rms_pre_pu",
        "operator": "<=",
        "threshold": 0.70,
        "unit": "pu"
      },
      {
        "metric": "rms_post_pu",
        "operator": ">=",
        "threshold": 0.50,
        "unit": "pu"
      },
      {
        "metric": "rms_post_pu",
        "operator": "<=",
        "threshold": 0.70,
        "unit": "pu"
      }
    ]
  }
}
