{
  "schema_version": "1.0",
  "scenario_id": "SAG_0001_three_phase_symmetric",
  "class": "Sag",
  "label_idx": 5,
  "label_source": "SCENARIO_CONTROLLER",
  "electrical_model": {
    "reference_model": "IEEE_9bus/IEEE_9bus_PQD_HIL_R2025a.slx",
    "working_model": "IEEE_9bus/IEEE_9bus_PQD_DISTURBANCES.slx",
    "model_unchanged": true
  },
  "injection_location": {
    "bus": "Bus4",
    "measurement_point": "Vabc_5",
    "mechanism": "FAULT_IMPEDANCE",
    "phase": "ABC"
  },
  "nominal_frequency_hz": 60.0,
  "sampling_rate_hz": 5000.0,
  "window_samples": 1000,
  "window_ms": 200.0,
  "seed": 42,
  "operating_condition_id": 1,
  "parameters": {
    "magnitude_pu": 0.735,
    "fault_resistance_ohms": 180.0,
    "ground_resistance_ohms": 0.01,
    "duration_cycles": 5.0,
    "duration_ms": 83.33,
    "onset_time_ms": 40.0,
    "transition_type": "POINT_ON_WAVE",
    "sensor_noise_snr_db": 52.0
  },
  "parameter_provenance": {
    "magnitude_pu": "STANDARD-SUPPORTED",
    "duration_cycles": "STANDARD-SUPPORTED",
    "duration_ms": "PROJECT-DESIGN-CHOICE",
    "onset_time_ms": "PROJECT-DESIGN-CHOICE",
    "transition_type": "ENGINEERING-INTERPRETATION",
    "fault_resistance_ohms": "SIMULATION-PARAMETER",
    "ground_resistance_ohms": "SIMULATION-PARAMETER",
    "sensor_noise_snr_db": "SIMULATION-PARAMETER"
  },
  "standard_references": [
    {
      "standard": "IEEE Std 1159-2019",
      "clause": "Table 2 / Clause 3.1.58",
      "applies_to": "Sag magnitude [0.10, 0.90] pu, duration 0.5 cycle to 1 min"
    },
    {
      "standard": "IEC 61000-4-30:2015",
      "clause": "Clause 5.2",
      "applies_to": "Half-cycle RMS U_rms(1/2) measurement aggregation"
    }
  ],
  "validation_gates": {
    "method": "WINDOWED_RMS",
    "pass_conditions": [
      {"metric": "windowed_rms_min_pu", "operator": ">=", "threshold": 0.10, "unit": "pu"},
      {"metric": "windowed_rms_min_pu", "operator": "<", "threshold": 0.90, "unit": "pu"},
      {"metric": "sag_duration_ms", "operator": ">=", "threshold": 8.33, "unit": "ms"},
      {"metric": "system_freq_hz", "operator": ">=", "threshold": 59.5, "unit": "Hz"},
      {"metric": "thd_percent", "operator": "<", "threshold": 5.0, "unit": "%"}
    ]
  },
  "normal_contamination_check": {
    "metric": "windowed_rms_min_pu",
    "must_differ_from_normal_by": "< 0.90 pu (depressed below Normal steady-state lower bound)"
  },
  "dataset_partition": {
    "group_id": "sag_cond01_seed42",
    "split": "test"
  }
}
