{
  "$schema": "../../docs/GATE3C_SCENARIO_SCHEMA.json",
  "schema_version": "1.0",
  "scenario_id": "NOT_0001_width600us_depth40pct",
  "class": "Notch",
  "label_idx": 4,
  "label_source": "SCENARIO_CONTROLLER",
  "electrical_model": {
    "reference_model": "IEEE_9bus/IEEE_9bus_PQD_HIL_R2025a.slx",
    "working_model": "IEEE_9bus/IEEE_9bus_PQD_DISTURBANCES.slx",
    "model_unchanged": true
  },
  "injection_location": {
    "bus": "Bus5",
    "measurement_point": "Vabc_5",
    "mechanism": "POWER_ELECTRONIC_SWITCH",
    "phase": "ABC"
  },
  "nominal_frequency_hz": 60.0,
  "sampling_rate_hz": 5000.0,
  "window_samples": 1000,
  "window_ms": 200.0,
  "seed": 20261007,
  "operating_condition_id": 1,
  "parameters": {
    "notch_width_us": 600.0,
    "notch_depth_pu": 0.40,
    "commutation_resistance_ohms": 150.0,
    "notch_repetition_per_cycle": 1,
    "phase_offset_ms": 5.0,
    "sensor_noise_snr_db": 52.0
  },
  "parameter_provenance": {
    "notch_width_us": "PROJECT-DESIGN-CHOICE",
    "notch_depth_pu": "ENGINEERING-INTERPRETATION",
    "commutation_resistance_ohms": "SIMULATION-PARAMETER",
    "notch_repetition_per_cycle": "ENGINEERING-INTERPRETATION",
    "phase_offset_ms": "ENGINEERING-INTERPRETATION",
    "sensor_noise_snr_db": "SIMULATION-PARAMETER"
  },
  "standard_references": [
    {
      "standard": "IEEE Std 1159-2019",
      "clause": "Clause 4.4.4.2, Table 2",
      "applies_to": "Voltage notching definition, sub-cycle waveform distortion (< 8.33 ms)"
    },
    {
      "standard": "IEEE Std 519-2022",
      "clause": "Clause 5.3, Table 2",
      "applies_to": "Voltage notch depth and commutation notch limits at PCC"
    }
  ],
  "validation_gates": {
    "method": "NOTCH_DETECTION",
    "pass_conditions": [
      {
        "metric": "notch_depth_pu",
        "operator": ">=",
        "threshold": 0.20,
        "unit": "pu"
      },
      {
        "metric": "notch_depth_pu",
        "operator": "<=",
        "threshold": 0.85,
        "unit": "pu"
      },
      {
        "metric": "notch_width_ms",
        "operator": ">=",
        "threshold": 0.4,
        "unit": "ms"
      },
      {
        "metric": "notch_width_ms",
        "operator": "<",
        "threshold": 8.33,
        "unit": "ms"
      },
      {
        "metric": "rms_full_pu",
        "operator": ">=",
        "threshold": 0.50,
        "unit": "pu"
      },
      {
        "metric": "rms_full_pu",
        "operator": "<=",
        "threshold": 0.80,
        "unit": "pu"
      },
      {
        "metric": "dominant_freq",
        "operator": ">=",
        "threshold": 59.5,
        "unit": "Hz"
      },
      {
        "metric": "dominant_freq",
        "operator": "<=",
        "threshold": 60.5,
        "unit": "Hz"
      }
    ]
  },
  "normal_contamination_check": {
    "metric": "notch_depth_pu",
    "must_differ_from_normal_by": "> 0.20 pu (Normal has no sub-cycle commutation notches)"
  },
  "dataset_partition": {
    "group_id": "not_cond01_seed20261007",
    "split": "train"
  }
}
